{
  "apiVersion": "contracts.platform/v1alpha1",
  "kind": "ComponentManifest",
  "requires": [],
  "optionalRequires": [],
  "conflicts": [],
  "dataServices": [],
  "migrations": [],
  "download": [
    {
      "artifact": "object-store-1.1.0.tar.zst",
      "sizeMiB": 120,
      "source": "registry.example.org/data/object-store:1.1.0",
      "verified": true,
      "checksum": "sha256:5e0a4b04"
    }
  ],
  "operations": [
    "backup",
    "restore",
    "verify-restore",
    "drain",
    "upgrade",
    "health",
    "slo"
  ],
  "implementation": {
    "status": "external",
    "notes": "Leveres som et eksternt produkt; installationsvejen beskrives i driftsdokumentationen."
  },
  "metadata": {
    "name": "object-store",
    "version": "1.1.0",
    "description": "S3-kompatibelt objektlager til dokumenter, snapshots og offsite backup.",
    "accountableHuman": {
      "subject": "oidc|anna.andersen",
      "name": "Anna Andersen",
      "role": "Platform Owner",
      "substitute": {
        "subject": "oidc|bo.bertelsen",
        "name": "Bo Bertelsen"
      }
    },
    "labels": {
      "tier": "data"
    }
  },
  "componentType": "data-service",
  "category": "data",
  "securityCore": false,
  "provides": {
    "capabilities": [
      "object-store"
    ],
    "dataServices": [
      {
        "id": "object-store",
        "kind": "object"
      }
    ]
  },
  "supportProfile": {
    "tier": "supported",
    "supportWindow": "24 måneder fra GA",
    "escalation": "Platform Owner"
  },
  "platforms": {
    "os": [
      "linux"
    ],
    "arch": [
      "x64",
      "arm64"
    ],
    "runtime": [
      "node>=22 <23",
      "node>=24 <25"
    ]
  },
  "resources": {
    "cpuMillicores": 200,
    "memoryMiB": 512,
    "storageGiB": 100,
    "nodes": 0
  }
}
